{
  "$schema": "http://json-schema.org/draft-07/schema#",
  "$id": "https://amd.example/m00/protocol-lock.schema.json",
  "type": "object",
  "additionalProperties": false,
  "required": ["schema_version", "lock_state", "owner", "locked_at", "base_contract_file_sha256", "base_contract_canonical_sha256", "shape_registry_sha256", "baseline_registry_sha256", "revision_registry_sha256", "whitelist_sha256", "schema_set_sha256", "m00_source_set_sha256", "analysis_sha256", "protected_path_sha256", "amendment_chain_genesis_sha256", "holdout_seal_state", "winner_lock_state"],
  "properties": {
    "schema_version": {"const": "1.0"},
    "lock_state": {"const": "locked"},
    "owner": {"type": "string", "minLength": 1, "maxLength": 128},
    "locked_at": {"$ref": "#/definitions/timestamp"},
    "base_contract_file_sha256": {"$ref": "#/definitions/sha"},
    "base_contract_canonical_sha256": {"$ref": "#/definitions/sha"},
    "shape_registry_sha256": {"$ref": "#/definitions/sha"},
    "baseline_registry_sha256": {"$ref": "#/definitions/sha"},
    "revision_registry_sha256": {"$ref": "#/definitions/sha"},
    "whitelist_sha256": {"$ref": "#/definitions/sha"},
    "schema_set_sha256": {"$ref": "#/definitions/sha"},
    "m00_source_set_sha256": {"$ref": "#/definitions/sha"},
    "analysis_sha256": {"$ref": "#/definitions/sha"},
    "protected_path_sha256": {
      "type": "object",
      "additionalProperties": false,
      "required": [".claude/skills/implement-verify-loop/SKILL.md", ".cursor/rules/hipblaslt-onboarding.mdc", ".cursor/skills/implement-verify-loop/SKILL.md", "CLAUDE.md", "AGENTS.md", ".agents/skills/design-discussion/SKILL.md", ".agents/skills/hipblaslt-code-trace/SKILL.md", ".agents/skills/implement-verify-loop/SKILL.md", ".agents/skills/learning-notes/SKILL.md", ".agents/skills/learning-quiz/SKILL.md", ".agents/skills/learning-roadmap-authoring/SKILL.md"],
      "properties": {
        ".claude/skills/implement-verify-loop/SKILL.md": {"$ref": "#/definitions/sha"},
        ".cursor/rules/hipblaslt-onboarding.mdc": {"$ref": "#/definitions/sha"},
        ".cursor/skills/implement-verify-loop/SKILL.md": {"$ref": "#/definitions/sha"},
        "CLAUDE.md": {"$ref": "#/definitions/sha"},
        "AGENTS.md": {"$ref": "#/definitions/sha"},
        ".agents/skills/design-discussion/SKILL.md": {"$ref": "#/definitions/sha"},
        ".agents/skills/hipblaslt-code-trace/SKILL.md": {"$ref": "#/definitions/sha"},
        ".agents/skills/implement-verify-loop/SKILL.md": {"$ref": "#/definitions/sha"},
        ".agents/skills/learning-notes/SKILL.md": {"$ref": "#/definitions/sha"},
        ".agents/skills/learning-quiz/SKILL.md": {"$ref": "#/definitions/sha"},
        ".agents/skills/learning-roadmap-authoring/SKILL.md": {"$ref": "#/definitions/sha"}
      }
    },
    "amendment_chain_genesis_sha256": {"$ref": "#/definitions/sha"},
    "holdout_seal_state": {"const": "not_registered"},
    "winner_lock_state": {"const": "not_registered"}
  },
  "definitions": {
    "sha": {"type": "string", "pattern": "^[0-9a-f]{64}$"},
    "timestamp": {"type": "string", "pattern": "^[0-9]{4}-[0-9]{2}-[0-9]{2}T[0-9]{2}:[0-9]{2}:[0-9]{2}Z$"}
  }
}
