{"amendment_chain_genesis_sha256":"94c989b9011499952d855994c775e8b7df8cd5c813b490189bae23905a384615","analysis_sha256":"d8d492473bf9821f85c8c2099188c1942ef7b8eeff6ad7c6034e39b3816dfc74","base_contract_canonical_sha256":"973be19674b5fa4d3bbafcbc15724ecbee908326acff81a82f0af71e1d1aca91","base_contract_file_sha256":"954d1439eecbf9032bc3394b28058fc8284f6562248840fe5fcd1b58371f8435","baseline_registry_sha256":"beb15294cb2c6d5a8373bc4a6235488f65a6c22fa2e7b8f49c1ee442048c6015","holdout_seal_state":"not_registered","lock_state":"locked","locked_at":"2026-07-24T05:49:04Z","m00_source_set_sha256":"74620d4c52df9d8b2180708d4c089c1f5cc05d427b3275690920072eb308f1cb","owner":"m00-implementer-repair-iteration-3-final-schema-aware","protected_path_sha256":{".agents/skills/design-discussion/SKILL.md":"413067e4c671e96dc08a5792da62f6f6858993184991df656daa960e32d5c79d",".agents/skills/hipblaslt-code-trace/SKILL.md":"61eeffd07fbd66deaecd7799a927a8bfd522488aa5b5570ec598313968f4d053",".agents/skills/implement-verify-loop/SKILL.md":"8b14344eefafb84b60a72eb5cf13ce1eb9ded139385fbd0abfda23533466aa59",".agents/skills/learning-notes/SKILL.md":"e66f14f5acc33ded139de6b2589704028e02cf3b8d3c53e1c158f42f92483a84",".agents/skills/learning-quiz/SKILL.md":"5093bfcdf82830be863ab2458097b96813615970de7972186d660913fe1ae86a",".agents/skills/learning-roadmap-authoring/SKILL.md":"b9c7b7a28775f5f9da9232824607c513877e49d604b3ed2934775fc725301c5e",".claude/skills/implement-verify-loop/SKILL.md":"a73c4d15464f3e05d814c546d87baa3373c14571b6bc4203032008a711c51c17",".cursor/rules/hipblaslt-onboarding.mdc":"9d06b053858cdaa156d26b6e269183cf0fffb4aa188d364219f59d57d17dc885",".cursor/skills/implement-verify-loop/SKILL.md":"a73c4d15464f3e05d814c546d87baa3373c14571b6bc4203032008a711c51c17","AGENTS.md":"ff2a38432998a47a0da671ed7428b0034703478bf05fcc6d2a3ed7a384e5646e","CLAUDE.md":"64ec23b36e5a6c5909b9a08fd8edea2a194a56fc13ac37ffcc8991acb38eeff9"},"revision_registry_sha256":"233b262a2d5eed00d4179e2eba4a510c01450109c931e4fe8d9cd2618e031b18","schema_set_sha256":"b2f088b2a1337752fc08927f654269263056a9af3ea81260a19599ada6d9af86","schema_version":"1.0","shape_registry_sha256":"81df7c73a8fdfa201a69b49f19d7e190c4b3d2c6db5940eab5fb6efc30c82ca1","whitelist_sha256":"0458d755cf1b8ad202255cc64f8f527bd38b9251cc6c98eb6a03f468ae4e6a76","winner_lock_state":"not_registered"}
